{
  "command_id": "gcdc-20260610-survey-tractor-001",
  "execution_id": "gce-20260610-tractor-drawbar-001",
  "command": "schema_exploration.survey_sources",
  "status": "SUCCEEDED",
  "terminal_reason": "target invocation accepted",
  "result_s3_uri": "s3://vehicle-graph-schema-generation-artifacts-317250221986-dev/gascity/executions/gce-20260610-tractor-drawbar-001/beads/vgemcd-101.3/output.json",
  "target_env": "dev",
  "completed_at": "2026-06-10T12:09:00Z"
}
